<?xml version="1.0" encoding="UTF-8"?>
<tns:aseguradora
	xmlns:tns="http://www.unican.es/ss/SegurosDomain"
	xmlns:xsi="http://www.w3.org/2001/XMLSchema-instance"
	xsi:schemaLocation="http://www.unican.es/ss/SegurosDomain SegurosDomain.xsd ">

	<tns:cliente dni="72391113E">
		<tns:nombre>Fernando Martínez</tns:nombre>
		<tns:email>fmartinez@unican.es</tns:email>
		<tns:seguro id="ABC-123456">
			<tns:tipo>TERCEROS</tns:tipo>
			<tns:vehiculo matricula="3467 KIO">
				<tns:potencia>100</tns:potencia>
				<tns:usoprofesional>false</tns:usoprofesional>
			</tns:vehiculo>
		</tns:seguro>
		<tns:seguro id="DEF-123456">
			<tns:tipo>TODO_RIESGO</tns:tipo>
			<tns:vehiculo matricula="3461 AZE">
				<tns:potencia>240</tns:potencia>
				<tns:usoprofesional>true</tns:usoprofesional>
			</tns:vehiculo>
		</tns:seguro>
		<tns:seguro id="FGH-123456">
			<tns:tipo>TODO_RIESGO</tns:tipo>
			<tns:vehiculo matricula="3462 PAU">
				<tns:potencia>150</tns:potencia>
				<tns:usoprofesional>false</tns:usoprofesional>
			</tns:vehiculo>
		</tns:seguro>
		<tns:parte>
			<tns:importe>112.0</tns:importe>
			<tns:fecha>2019-02-05+12:14</tns:fecha>
			<tns:seguro>FGH-123456</tns:seguro>
		</tns:parte>
	</tns:cliente>
	
	<tns:cliente dni="71391113E">
		<tns:nombre>Fernando Martínez</tns:nombre>
		<tns:email>fmartinez@unican.es</tns:email>
		<tns:seguro id="IJK-123456">
			<tns:tipo>TERCEROS</tns:tipo>
			<tns:vehiculo matricula="3467 KIO">
				<tns:potencia>100</tns:potencia>
				<tns:usoprofesional>true</tns:usoprofesional>
			</tns:vehiculo>
		</tns:seguro>
		<tns:parte>
			<tns:importe>112.0</tns:importe>
			<tns:fecha>2019-02-05+12:14</tns:fecha>
			<tns:seguro>FGH-123456</tns:seguro>
		</tns:parte>
	</tns:cliente>
	
</tns:aseguradora>
